<?xml version="1.0" encoding="UTF-8"?>

<conf
    xmlns:xsi='http://www.w3.org/2001/XMLSchema-instance'
    xsi:noNamespaceSchemaLocation='iceberg.conf.xsd'>

    <workFolder>/var/opt/iceberg</workFolder>
    <backupJobs>
        <job id="job-1">
            <description>Job One</description>
            <source>
                <path>/var/opt/data/files</path>
                <excludePattern></excludePattern>
            </source>
            <target enabled="true">
                <region>eu-west-1</region>
                <vault>test-1</vault>
            </target>
        </job>
    </backupJobs>
</conf>
